Title,Description,Section,Paper
"After a year of freedom, why are my brothers still inside?",I came out of immigration detention in January after eight years. But my friends left behind continue to suffer.,National,https://www.brisbanetimes.com.au//national/after-a-year-of-freedom-why-are-my-brothers-still-inside-20211207-p59fgi.html
Celebrating an ‘academic pandemic’ for three generations,"Travel was off the cards, but the COVID-19 pandemic was a catalyst for us to hit the books and aim for the next level in our careers.",Victoria,https://www.brisbanetimes.com.au//national/victoria/celebrating-an-academic-pandemic-for-three-generations-20211207-p59fi5.html
Rental prices tipped to rise as vacancies hit multi-year low,"Renters across Australia face fewer options in finding their next home, with vacancy rates at a multi-year low and expected to fall further.",News,https://www.brisbanetimes.com.au//property/news/rental-prices-tipped-to-rise-as-vacancies-hit-multi-year-low-20211206-p59f5e.html
"Game, set and match as Lleyton Hewitt sells grand slam home",Aussie tennis ace Lleyton Hewitt and his TV-star wife Bec have sold the Toorak home they lived in for five years for between $15 million and $16 million.,News,https://www.brisbanetimes.com.au//property/news/game-set-and-match-as-lleyton-hewitt-sells-grand-slam-home-20211202-p59e5r.html
Architect ‘taken aback’ by reaction to Norfolk pine-inspired building,"When the scaffolding came down from a new apartment building on the Gold Coast, social media was flooded with photos taken by awestruck locals.",Living,https://www.brisbanetimes.com.au//property/living/architect-taken-aback-by-reaction-to-norfolk-pine-inspired-building-20211124-p59cvq.html
The houses you can buy for less than $1 million in the major capitals,"This segment of the market is hot property even for run-down homes, attracting first-home buyers and growing families as they try to get a foot on the ladder.",Living,https://www.brisbanetimes.com.au//property/living/the-houses-you-can-buy-for-less-than-1-million-in-the-major-capitals-20211130-p59dhv.html
"‘The boom isn’t over’: Housing market growing, just not by as much","The latest figures reveal Australian housing values edged upwards in November, but at their slowest rate since January.",News,https://www.brisbanetimes.com.au//property/news/the-boom-isn-t-over-housing-market-growing-just-not-by-as-much-20211201-p59ds9.html
The Guccis are really not happy about ‘House of Gucci’,"Following its release in the US, the family issued a statement claiming it is “anything but accurate” while taking aim at the depiction of Patrizia Reggiani played by Lada Gaga.",Fashion,https://www.brisbanetimes.com.au//lifestyle/fashion/the-guccis-are-really-not-happy-about-house-of-gucci-20211202-p59e32.html
Does smiling really make you look younger?,"A new study has found that smiling actually makes people look older – unless they are over 60, in which case the wrinkles have set in and it makes little difference.",Beauty,https://www.brisbanetimes.com.au//lifestyle/beauty/does-smiling-really-make-you-look-younger-20211206-p59f3l.html
The luxury consignment stores selling out on Instagram,Purchasing high-end pre-loved clothing via live Instagram auctions provided a retail therapy hit for many during lockdown. It’s not slowing down any time soon.,Fashion,https://www.brisbanetimes.com.au//lifestyle/fashion/the-luxury-consignment-stores-selling-out-on-instagram-20211118-p59a0o.html
Why I took my daughter to India for Schoolies,"As a teen, Sean Doyle struggled to navigate the larger world. So when his daughter Anna finished school, he chose something significant to mark that key moment in her life.",Life & relationships,https://www.brisbanetimes.com.au//lifestyle/life-and-relationships/i-took-my-daughter-to-india-for-schoolies-to-give-her-something-i-could-ve-used-20211203-p59ep7.html
"Christmas Gift guide: best fashion, tech, home",Looking for perfect presents for your loved ones? Our bumper Christmas gift guide has all the inspiration you need.,Life & relationships,https://www.brisbanetimes.com.au//lifestyle/life-and-relationships/the-ultimate-gift-guide-for-fashion-home-and-beauty-lovers-20211123-p59bby.html
Best in show: the top TV programs of 2021,"There was so much great TV in 2021, our panel of critics couldn’t settle on one single winner.",TV & radio,https://www.brisbanetimes.com.au//culture/tv-and-radio/best-in-show-the-tv-highlights-of-a-year-like-no-other-20211203-p59emz.html
‘Look at your people’: What Australia’s screen industry can learn from Encanto,"Disney’s new animated blockbuster - a magical-realist family fable set in Colombia - should inspire us to tell our own diverse stories, say its stars.",Movies,https://www.brisbanetimes.com.au//culture/movies/look-at-your-people-what-australia-s-screen-industry-can-learn-from-encanto-20211122-p59azk.html
Drake withdraws himself from competition for 2022 Grammy Awards,The chart-topping rapper and singer’s withdrawal is just the latest problem for the embattled awards.,Music,https://www.brisbanetimes.com.au//culture/music/drake-withdraws-himself-from-competition-for-2022-grammy-awards-20211207-p59fi8.html
Engrossing short stories and new work from a Booker winner: what to read this week,Giselle Au-Nhien Nguyen and Steven Carroll have cast their eyes over recent fiction and non-fiction releases.,Books,https://www.brisbanetimes.com.au//culture/books/stories-from-another-wolitzer-and-evaristo-s-manifesto-what-to-read-20211129-p59d37.html
Five stars for this showstopping and hilarious stage spectacle,"Theatrically, Neil Armfield’s unflagging production is, for this reviewer, the best in Pinchgut’s 20-year history.",Opera,https://www.brisbanetimes.com.au//culture/opera/this-wild-party-is-the-best-yet-from-pinchgut-20211202-p59e5u.html
Root cannot be haunted by England’s Gabba ghosts,"If it’s grey above and green below, England captain Joe Root must be prepared to back his bowlers – and forget what happened at the Gabba 19 years ago.",Cricket,https://www.brisbanetimes.com.au//sport/cricket/root-cannot-be-haunted-by-england-s-gabba-ghosts-20211207-p59fgr.html
Box seat: Pakula says day-night Ashes Test at MCG too good to pass up,"Melbourne’s sporting precinct could become the centre of world sport in the middle of January, with the Victorian Government saying the MCG’s case to host the fifth Ashes Test as the Australian Open begins is undeniable.",Cricket,https://www.brisbanetimes.com.au//sport/cricket/day-night-ashes-test-at-the-mcg-too-good-to-pass-up-pakula-20211207-p59fn2.html
Smith’s Ashes advice to Australia’s new captain,Steve Smith has advice for Pat Cummins that only comes from hard personal experience.,Cricket,https://www.brisbanetimes.com.au//sport/cricket/smith-s-ashes-advice-to-australia-s-new-captain-20211207-p59fkl.html
‘Daunting prospect’: Why Warner’s 2019 nightmare has no bearing on Ashes,Captain Pat Cummins’ assessment of the dynamic opener’s fear factor in the nets highlights England’s difficulty in taming the man known as ‘The Bull’ on Australian soil.,Cricket,https://www.brisbanetimes.com.au//sport/cricket/daunting-prospect-why-warner-s-2019-nightmare-has-no-bearing-on-ashes-20211207-p59fjx.html
Cummins says Australia won’t be ‘picking fights’ during a testing Ashes summer,"Pat Cummins knows tensions will rise on the field during an intense series, but has laid down some cultural foundations for his team before the series against England.",Cricket,https://www.brisbanetimes.com.au//sport/cricket/cummins-says-australia-won-t-be-picking-fights-during-a-testing-ashes-summer-20211207-p59fl6.html
Aus Open intrigue as Djokovic signs on for Sydney event,"World No.1 Novak Djokovic has committed to the ATP Cup in Sydney, a tournament that requires players to submit to the same vaccination rules as the Australian Open.",Tennis,https://www.brisbanetimes.com.au//sport/tennis/novak-djokovic-confirmed-for-atp-cup-in-sydney-organisers-say-20211207-p59fkj.html
Socceroos and Sydney FC star Grant tests positive for COVID-19,"Socceroo Rhyan Grant, who is fully vaccinated, returned a positive test for COVID-19 on Tuesday, ruling him out of both training and matches for the next two weeks.",Soccer,https://www.brisbanetimes.com.au//sport/soccer/socceroos-and-sydney-fc-star-grant-tests-positive-for-covid-19-20211207-p59fk7.html
Follow the victors - the modern template to beating Australia at home,"Once unbeatable at home, Australia have lost six Test series on home soil in the last 13 years. Have India and South Africa provided a road map for the English to win the Ashes?",Cricket,https://www.brisbanetimes.com.au//sport/cricket/follow-the-victors-the-modern-template-to-beating-australia-at-home-20211205-p59ex2.html
‘You can see the spark in his eye’: Bigger Ben looms over the Ashes,"The exotic talent of Ben Stokes is there for all to see, but there is so much more to what makes him tick.",Cricket,https://www.brisbanetimes.com.au//sport/cricket/you-can-see-the-spark-in-his-eye-bigger-ben-looms-over-the-ashes-20211206-p59f9j.html
"Red Bull cranks up pressure on F1 race chief, Australia’s Michael Masi","Helmut Marko has added to the pressure that has been steadily building on Australian FIA race director Michael Masi over the past few weeks, saying the decision-making by Masi and race stewards in Saudi Arabia on Sunday was “very one-sided”.",Motorsport,https://www.brisbanetimes.com.au//sport/motorsport/red-bull-cranks-up-pressure-on-f1-race-chief-australia-s-michael-masi-20211207-p59fi9.html
Broadcasters want the fifth Ashes Test at the ‘iconic’ MCG or SCG,Broadcasters will be central to bidding for the fifth Ashes Test and already have a strong preference for Melbourne or Sydney to host the clash.,Cricket,https://www.brisbanetimes.com.au//sport/cricket/broadcasters-want-the-fifth-ashes-test-at-the-iconic-mcg-or-scg-20211207-p59fjc.html
‘I sense something there’: Can teen sensation lift Kerr even higher?,Think you’ve seen the best of Sam Kerr? Think again. Tony Gustavsson believes her young teammate Mary Fowler can help the Australian captain go to a new level.,Soccer,https://www.brisbanetimes.com.au//sport/soccer/i-sense-something-there-how-mary-fowler-can-help-sam-kerr-get-even-better-20211207-p59fh4.html
"Anderson out of first Ashes Test, saved for the pink ball","Anderson’s withdrawal from contention for England’s bowling attack for the first Ashes Test at the Gabba caused a hubbub, but the move looks as much tactical as it is medical.",Cricket,https://www.brisbanetimes.com.au//sport/cricket/jimmy-anderson-out-of-first-ashes-test-saved-for-pink-ball-20211207-p59ffv.html
Why is Shane Warne so harsh in his criticism of Australian players?,The leg-spinning great didn’t handle criticism well as a player but he doesn’t mind handing it out as a commentator.,Cricket,https://www.brisbanetimes.com.au//sport/cricket/why-is-shane-warne-so-harsh-in-his-criticism-of-australian-players-20211206-p59f9u.html
Symonds bewildered at BBL dropped catch,Ashes hopeful Jimmy Peirson had a moment to forget in Brisbane's loss to the Sydney Thunder.,Cricket,https://www.brisbanetimes.com.au//sport/cricket/symonds-bewildered-at-bbl-dropped-catch-20211207-p59fde.html
'Proud grinch': Why some people are not in the mood for Christmas,"It's supposed to be the ""most wonderful time of the year"", but two years of a pandemic means not everyone is in good cheer as Christmas nears.",Misc News,https://abc.net.au/news/2021-12-08/christmas-grinch-struggle-festive-cheer/100679300
"Nearly 25 years after an appalling murder, this couple is keeping a promise from a world away","After Japanese student Michiko Okuyama was killed in Cairns in 1997, Luiza and John Grave promised her family they would maintain her memorial garden. A quarter of a century later, they're still as good as their word.",Misc News,https://abc.net.au/news/2021-12-08/cairns-couple-keeps-25yo-promise-made-after-students-murder/100679260
On the upside the drought map is finally clear. On the downside more flooding is expected this week,More rain and renewed flooding are expected for the east this week as many catchments are already at capacity.,Misc News,https://abc.net.au/news/2021-12-08/more-rain-flooding-east-coast/100680488
"Two years after a protected species was found in remote bushland, the patch of land was listed for logging","When 19 greater gliders were found in 2018, environmentalists thought their patch of forest would be protected. They are baffled by what has happened since, and fear the area will soon be logged.",Misc News,https://abc.net.au/news/2021-12-08/greater-gliders-found-east-gippsland-forest-to-be-logged/100667322
'My mental health struggles have no connection with my worth as a Muslim',"When Lina faced mental health problems, she says some in her community told her she ""wasn't praying enough"", and was an ""ungrateful, un-Islamic person"". She wants that to change.",Misc News,https://abc.net.au/news/2021-12-08/idpwd-mental-health-and-islam/100643544
"'Ask me about my missing colon': Life, health and dating with ulcerative colitis",Amelia shares her experience of living with severe ulcerative colitis and how she's found being open about her condition has helped her get back to living her best life. A sense of humour helps too. ,Misc News,https://abc.net.au/news/2021-12-08/amelia-shares-her-experience-of-living-with-a-stoma/100607658
On the upside the drought map is finally clear. On the downside more flooding is expected this week,More rain and renewed flooding are expected for the east this week as many catchments are already at capacity.,Misc News,https://abc.net.au/news/2021-12-08/more-rain-flooding-east-coast/100680488
Is Bellerive really on the nose? It's just not cricket,"With Hobart now forced into a race to secure the fifth Ashes Test against mainland rivals, Chris Rowbottom asks why it wasn't awarded outright — is the game in such brittle condition that playing one Ashes test in Tasmania will see it crumble?",Misc News,https://abc.net.au/news/2021-12-08/analysis-bellerive-in-bidding-war-for-ashes-fifth-test-cricket/100678234
Emails reveal Pfizer was 'enthusiastic' to engage with Australia about COVID-19 vaccine,Documents obtained under freedom of information laws shed new light on Pfizer and the government's dealings at a critical time for negotiations last year.,Misc News,https://abc.net.au/news/2021-12-07/new-emails-reveal-how-enthusiastic-pfizer-to-engage-australia/100680842
Shooters called in as rabbits plague Parliament House,Public servants in Canberra step up efforts to kill rabbits near Parliament House by employing professional shooters.,Misc News,https://abc.net.au/news/2021-12-07/nca-shoots-rabbits-near-parliament-to-control-numbers/100680890
Vote now: What has been the greatest men's Ashes moment of the past 40 years? ,"As the men's Ashes series finally returns to Australian shores, ABC Sport is looking back at the 40 greatest moments of the past 40 years. Have your say and vote for your favourite moment.",Misc News,https://abc.net.au/news/2021-12-07/the-ashes-40-greatest-moments-since-1981/100594174
'We would have won': Kim Hughes reveals the selection choices that cost the Aussies at Headingley in 1981,"With the home side facing odds of 500-1 to win at Headingley in 1981, two stoic Englishmen stood in the way of Kim Hughes leading his Australians to a famous victory — and it's a string of events the former captain has been trying to forget since.",Misc News,https://abc.net.au/news/2021-12-07/ashes-australia-england-kim-hughes-miracle-at-headingley/100665526
Everything you need to know ahead of the first Ashes Test at the Gabba,The first Ashes Test gets underway at the Gabba on Wednesday. Here's everything you need to know.,Misc News,https://abc.net.au/news/2021-12-07/everything-you-need-to-know-about-the-first-ashes-test/100679298
'They are way more united': Australian coach says Opals are preparing for life after Liz,"The coach of the Australian women's basketball team says there is a more visible camaraderie among the Opals without Liz Cambage, who made it clear she has zero interest in playing for the national team again.",Misc News,https://abc.net.au/news/2021-12-07/opals-more-united-without-liz-cambage-sandy-brondello-world-cup/100680636
Sydney FC player tests positive for COVID-19,"Sydney FC says no other members of its squad have been affected, with Wednesday's FFA Cup game against Macarthur FC set to proceed.",Misc News,https://abc.net.au/news/2021-12-07/sydney-fc-player-tests-positive-for-covid-19/100680292
'Don't double up': Premier's message to Cricket Australia as fifth Test tender begins,Cricket Australia announces it will put the fifth Test out for tender after cancelling the Perth clash over COVID restrictions.,Misc News,https://abc.net.au/news/2021-12-07/fifth-ashes-test-to-go-to-tender-as-perth-replaced/100679416
Tommy Fury pulls out of Jake Paul fight,Tommy Fury says he has been forced to withdraw from his upcoming fight with YouTuber-turned-boxer Jake Paul due to a severe chest infection and a broken rib.,Misc News,https://abc.net.au/news/2021-12-07/tommy-fury-pulls-out-of-jake-paul-fight/100679526
"A-League Women's wrap: Wellington, Sydney and Victory shine",Can underdogs Wellington Phoenix shake up the A-League Women's established order? Will Sydney's front three continue firing? And just how much better can Melbourne Victory get? Samantha Lewis reviews round one.,Misc News,https://abc.net.au/news/2021-12-07/a-league-womens-wrap-wellington-sydney-victory/100678842
'A cry for help': Olympian Maddie Groves says she was molested as a teenage swimmer,"Australian Olympic swimmer Madeline Groves says she was sexually abused by a man who still works in swimming and says there is a culture of ""misogyny” and “perversion"" in the sport.",Misc News,https://abc.net.au/news/2021-12-08/olympic-swimmer-maddie-groves-says-she-was-sexually-abused/100669340
Australians have lost at least $109 million in cryptocurrency scams this year. These three know all about it,"Australian police say cryptocurrency scams have ""exploded"" during the pandemic. These three families were sucked in.",Misc News,https://abc.net.au/news/2021-12-08/cryptocurrency-scams-targeting-australians-losing-millions/100678848
"Five test positive to COVID-19 after boat cruise on Sydney Harbour, concerns two are Omicron variant","NSW Health is urgently contacting around 140 people who were on the boat and directing them and members of their households to immediately get tested, isolate and await further public advice.",Misc News,https://abc.net.au/news/2021-12-08/boat-party-sydney-harbour-covid-omicron/100681874
Do you believe a foam roller helps with muscle pain after exercise? Here's what science says,Many people swear by foam rollers to reduce muscle pain and increase flexibility after exercise. But does the science support anecdotal evidence that encourages their use?,Misc News,https://abc.net.au/news/2021-12-08/muscle-pain-exercise-do-foam-rollers-work/100680802
Saudi agent suspected of Jamal Khashoggi killing arrested at French airport,"The man, a former Royal Guard of Saudi Arabia, was reportedly arrested by authorities at Charles de Gaulle airport near Paris as he was about to board a flight to Saudi capital Riyadh.",Misc News,https://abc.net.au/news/2021-12-08/french-police-arrest-suspected-jamal-khashoggi-killer-at-airport/100681878
"Aung San Suu Kyi has been sentenced, so what led to the former icon of Myanmar's pro-democracy movement being charged?",Aung Sang Suu Kyi is set to spend the next two years in detention in a case widely seen as contrived and dismissed by critics as a farce.,Misc News,https://abc.net.au/news/2021-12-06/who-is-aung-san-suu-kyi-jailed-myanmar-junta-/100678206
Here's what we know about provisional approval for younger kids to get COVID-19 vaccine,When can kids get Pfizer? Is it the same vaccine adults receive? And should all kids be getting it? Here are the details of the rollout of vaccines for children aged five to 11 years.,Misc News,https://abc.net.au/news/2021-12-05/five-to-11-year-olds-covid-vaccination-rollout-explainer/100675364
" Charging the parents after a US school shooting is unusual, but it has happened before","Guns used in United States school shootings have often come from the homes of young perpetrators but parents are rarely charged for the violence that occurs, experts say.",Misc News,https://abc.net.au/news/2021-12-05/charging-parents-ethan-crumbley-unusual-but-has-happened-before/100675352
BHP's COVID vaccine mandate at a NSW mine has been found unlawful. Will it have national implications? ,"The Fair Work Commission says BHP's vaccine mandate at its Mt Arthur Coal mine was unlawful because workers weren't consulted properly, not because mandates are illegal.",Misc News,https://abc.net.au/news/2021-12-04/bhp-vaccine-mandate-mt-arthur-found-unlawful-but-explainer-covid/100674164
Is Bellerive really on the nose? It's just not cricket,"With Hobart now forced into a race to secure the fifth Ashes Test against mainland rivals, Chris Rowbottom asks why it wasn't awarded outright — is the game in such brittle condition that playing one Ashes test in Tasmania will see it crumble?",Misc News,https://abc.net.au/news/2021-12-08/analysis-bellerive-in-bidding-war-for-ashes-fifth-test-cricket/100678234
The surprising architect behind Labor's climate plans? A retiring Coalition minister,"Before he became Health Minister, Greg Hunt spent years thinking about mechanisms for getting emissions down – and if elected, Labor plans to road test the one he introduced, writes Peter Martin.",Misc News,https://abc.net.au/news/2021-12-08/unsung-architect-labor-climate-policy-greg-hunt-retiring/100680684
Do you believe a foam roller helps with muscle pain after exercise? Here's what science says,Many people swear by foam rollers to reduce muscle pain and increase flexibility after exercise. But does the science support anecdotal evidence that encourages their use?,Misc News,https://abc.net.au/news/2021-12-08/muscle-pain-exercise-do-foam-rollers-work/100680802
A Supreme Court storm is brewing for American women,Since 2016 a wave of abortion bans in the US have taken aim at the landmark 1973 Supreme Court decision that guaranteed abortion as a constitutional right. Now a new case in the US Supreme Court is the most significant threat to abortion rights in the US in decades.,Misc News,https://abc.net.au/news/2021-12-07/roe-v-wade-abortion-can-it-be-overturned-debate-explained/100680360
"'Eye-watering levels of debt' mean the Reserve Bank will have to be careful when it starts lifting rates, analysts warn","The Reserve Bank keeps interest rates at a record low and maintains its current stimulus, re-emphasising its patience to see inflation and wages growth increase more sustainably before considering a rate rise.",Misc News,https://abc.net.au/news/2021-12-07/reserve-bank-interest-rates-monetary-policy-december-2021/100680008
Industry titans pair up to develop green hydrogen projects at vast steelworks site,BlueScope and Shell have announced they are embarking on a joint venture to build a hydrogen electrolyser at Port Kembla.,Misc News,https://abc.net.au/news/2021-12-07/bluescope-and-shell-announce-green-hydrogen-plan-for-port-kembla/100679982
"In the US, a boss sacked 900 staff over video call — but could it happen here?","A US mortgage company sacked hundreds of employees over video call just before Christmas, but experts say there are protections against that behaviour in Australia.",Misc News,https://abc.net.au/news/2021-12-07/boss-fires-900-employees-over-zoom-just-before-christmas/100679068
"It's a lucrative market worth billions, but it equates to just 18 cents a shirt for workers","You've found the perfect dress. You've tried it on before and you know it looks great. Now it's on sale, a discount so large the store is practically giving it away. Should you buy it?",Misc News,https://abc.net.au/news/2021-12-06/fast-fashion-shoppers-ethical-concerns/100673362
"'It's too quiet': The night before Cleo Smith was found, our cameraman had a strange inkling","James Carmody reflects on three weeks covering the search for Cleo Smith, interviewing her distraught parents as they pleaded for public help, and the moment he learnt the little girl had been found.",Misc News,https://abc.net.au/news/backstory/2021-11-24/how-abc-news-covered-cleo-smith-disappearance-rescue/100630676
Grain for Hope campaign launched to raise money for cancer research,Victorian grain growers experiencing one of the best seasons in recent memory are being asked to donate some of their harvest this year to help fight cancer. ,Misc News,https://abc.net.au/news/rural/2021-12-07/grain-for-hope-cancer-research-campaign/100672422
How this Victorian queer community is finding beauty and identity through clothing swap,"When we are getting ready in the morning, most of us rummage through the wardrobe trying to pick out what we're going to wear that day. But for some people, it's not that simple.",Misc News,https://abc.net.au/news/2021-12-07/regional-victorian-clothing-swap-giving-bendigo-queer-commnuity/100678726
"When she was six, Hannah suffered a massive stroke. Now she's back in the classroom, thanks to a program that started in 1943",How Hannah and other seriously ill children stay connected to their school friends and studies with the help of the Perth Children's Hospital school program. ,Misc News,https://abc.net.au/news/2021-12-06/perth-hospital-school-program-helps-sick-and-injured-children/100668902
