Title,Description,Section,Paper
Newsletter Signup Redirect | The Age,,newsletter-signup,https://theage.com.au/newsletter-signup?newsletter=explainer
"New Sudoku playable every day on the web, mobile and app as part of your digital subscription",,puzzles,https://theage.com.au/puzzles
Desperate triple-zero calls unanswered as a life ticked away,"Victoria’s triple-zero service is supposed to work seamlessly, but when Nick Panagiotopoulos, 47, tried had to call an ambulance in October, something went terribly wrong.",Victoria,https://theage.com.au/national/victoria/desperate-triple-zero-calls-unanswered-as-a-life-ticked-away-20211206-p59fbr.html
Australia won’t send officials to China for Winter Olympics,A final decision will be made within days on whether to follow the US and launch a full diplomatic boycott in a rebuke of Beijing over its human rights record.,Federal,https://theage.com.au/politics/federal/australia-won-t-send-officials-to-china-for-winter-olympics-20211207-p59fee.html
Primary schools in focus as state’s COVID-19 outbreak shifts gear,"Primary schools are at the centre of most large COVID-19 clusters recorded in Victoria, as infections in unvaccinated children, who doctors say mostly have mild symptoms, remain high.",Victoria,https://theage.com.au/national/victoria/primary-schools-in-focus-as-state-s-covid-19-outbreak-shifts-gear-20211207-p59fe9.html
Children now account for highest rates of COVID-19 infection in Europe,WHO Europe regional director Dr Hans Kluge urged countries to protect children and schools amid a rapid rise in cases among the 5 to 14 age group in the region.,Europe,https://theage.com.au/world/europe/children-now-account-for-highest-rates-of-covid-19-infection-in-europe-20211208-p59fok.html
Nathan Lyon and subtleties of spin will be crucial in stopping Stokes,"In the fourth part of a deep dive into the strategies and showdowns that will shape the Ashes, we examine how Australia might best quell Ben Stokes’ brilliant bat.",Cricket,https://theage.com.au/sport/cricket/ashes-head-to-heads-why-cummins-is-australia-s-best-bet-against-root-20211202-p59eap.html
Everything you need to know about the first Ashes Test,"The battle for cricket’s most famous urn is upon us. Here is all the information you’ll need; from teams, times and tips to television details, weather reports and key match-ups.",Cricket,https://theage.com.au/sport/cricket/everything-you-need-to-know-about-the-first-ashes-test-20211207-p59fm8.html
Dusting off the Ashes: it’s time to play,"There hasn’t been so much as build-up to the Ashes as a scrambling into position. But when play starts, we’ll be as transfixed as ever.",Cricket,https://theage.com.au/sport/cricket/dusting-off-the-ashes-it-s-time-to-play-20211207-p59fie.html
Root cannot be haunted by England’s Gabba ghosts,"If it’s grey above and green below, England captain Joe Root must be prepared to back his bowlers – and forget what happened at the Gabba 19 years ago.",Cricket,https://theage.com.au/sport/cricket/root-cannot-be-haunted-by-england-s-gabba-ghosts-20211207-p59fgr.html
Fraser-McGurk screamer helps Renegades win thriller against Strikers,An early contender for catch of the season from Jake Fraser-McGurk has helped the Melbourne Renegades overcome a dramatic batting collapse to beat the Adelaide Strikers by two runs.,Cricket,https://theage.com.au/sport/cricket/fraser-mcgurk-screamer-helps-renegades-win-thriller-against-strikers-20211207-p59fec.html
"While other industries suffered, Aussie film and TV production had a record year",Screen Australia’s annual survey of drama production showed it reached a record $1.9 billion last financial year.,Movies,https://theage.com.au/culture/movies/while-other-industries-suffered-aussie-film-and-tv-production-had-a-record-year-20211207-p59fho.html
The ultimate rejection: how to tell your mum you don’t want kids,"A new play, commissioned by Red Stitch, looks at one of the hardest life decisions to make – and how it can affect your family relationships.",Theatre,https://theage.com.au/culture/theatre/the-ultimate-rejection-how-to-tell-your-mum-you-don-t-want-kids-20211207-p59fhr.html
Booming regions take edge off Melbourne’s COVID recession,"Bumper harvests helped spur economic activity in rural and regional Victoria, as the pandemic sent Melbourne into recession.",Victoria,https://theage.com.au/national/victoria/booming-regions-take-edge-off-melbourne-s-covid-recession-20211207-p59ffn.html
‘They don’t treat you like a problem child’: Foyers a fix for youth homelessness,"Facilities at three TAFE campuses help people aged 16 to 24 who want to study but can’t live at home. On Wednesday, the youth foyers program will receive a funding boost.",Victoria,https://theage.com.au/national/victoria/they-don-t-treat-you-like-a-problem-child-foyers-a-fix-for-youth-homelessness-20211207-p59ff0.html
"Sydney, Melbourne house prices in surprise fall at auction","The median auction house price fell in Sydney and Melbourne last month, as a huge volume of listings offered buyers more choice. Is it a blip, or could booming house price growth be coming to an end?",News,https://theage.com.au/property/news/sydney-melbourne-house-prices-in-surprise-fall-at-auction-20211207-p59fgd.html
Turtle recall: Beaumaris fossil changes ‘our understanding of the history of life on this continent’,"The five-million-year-old specimen was found in Melbourne’s bayside almost 100 years ago, but its significance has only just been discovered.",National,https://theage.com.au/national/turtle-recall-beaumaris-fossil-changes-our-understanding-of-the-history-of-life-on-this-continent-20211206-p59fb5.html
Biden warns Putin in talks to expect sanctions if he invades Ukraine,"It was the fourth direct conversation between the two leaders this year, following two calls and one summit in Geneva that was itself prompted by a Russian troop buildup near Ukraine.",Europe,https://theage.com.au/world/europe/biden-and-putin-hold-talks-amid-rising-tensions-over-ukraine-20211208-p59fon.html
Police seize $1.8 million in cash stacked on CBD hotel coffee table,Three men have been jailed after police found 250 kilograms of methamphetamine concealed in a shipment of tyres bound for Australia.,Victoria,https://theage.com.au/national/victoria/police-seize-1-8-million-in-cash-stacked-on-cbd-hotel-coffee-table-20211207-p59fg5.html
Australia news LIVE: NSW’s Omicron COVID cluster grows; first Ashes test due to begin in Brisbane,"Another Liberal elder has encouraged Gladys Berejiklian to run for federal politics, Victoria’s coronavirus outbreak isn’t slowing down but is changing shape and Australia won’t send officials to China for the Winter Olympics.",National,https://theage.com.au/national/australia-news-live-nsw-s-omicron-covid-cluster-grows-first-ashes-test-due-to-begin-in-brisbane-20211207-p59fl5.html
Biden warns Putin in talks to expect sanctions if he invades Ukraine,"It was the fourth direct conversation between the two leaders this year, following two calls and one summit in Geneva that was itself prompted by a Russian troop buildup near Ukraine.",Europe,https://theage.com.au/world/europe/biden-and-putin-hold-talks-amid-rising-tensions-over-ukraine-20211208-p59fon.html
"While other industries suffered, Aussie film and TV production had a record year",Screen Australia’s annual survey of drama production showed it reached a record $1.9 billion last financial year.,Movies,https://theage.com.au/culture/movies/while-other-industries-suffered-aussie-film-and-tv-production-had-a-record-year-20211207-p59fho.html
Desperate triple-zero calls unanswered as a life ticked away,"Victoria’s triple-zero service is supposed to work seamlessly, but when Nick Panagiotopoulos, 47, tried had to call an ambulance in October, something went terribly wrong.",Victoria,https://theage.com.au/national/victoria/desperate-triple-zero-calls-unanswered-as-a-life-ticked-away-20211206-p59fbr.html
‘Victory for people power’: CBD site saved from demolition as developer plans $34m ‘top-up’ tower,"Melbourne House in Little Bourke Street has been spared following a campaign over several years, but residents remain concerned heritage protections in the CBD do not go far enough.",Victoria,https://theage.com.au/national/victoria/victory-for-people-power-cbd-site-saved-from-demolition-as-developer-plans-34m-top-up-tower-20211207-p59fe8.html
Can Prince Harry’s rift with his father ever be healed?,The already fragile relationship between the heir to the throne and his youngest son appears at breaking point after Harry claimed he had raised concerns about Charles’ “cash for access” crisis.,Europe,https://theage.com.au/world/europe/can-prince-harry-s-rift-with-his-father-ever-be-healed-20211207-p59ffy.html
‘You can see the spark in his eye’: Bigger Ben looms over the Ashes,"The exotic talent of Ben Stokes is there for all to see, but there is so much more to what makes him tick.",Cricket,https://theage.com.au/sport/cricket/you-can-see-the-spark-in-his-eye-bigger-ben-looms-over-the-ashes-20211206-p59f9j.html
‘Bloodlust’ warning as Labor MPs discuss switch to crossbench,Premier Daniel Andrews is being urged to intervene to protect some of the under-fire MPs aligned with sacked former minister Adem Somyurek.,Victoria,https://theage.com.au/politics/victoria/bloodlust-warning-as-labor-mps-discuss-switch-to-crossbench-20211207-p59fkb.html
Mother demands border lockout apology as Ombudsman finds permit system ‘unjust’,"The state government has acknowledged thousands of people stranded outside Victoria earlier this year endured a “difficult time”, after the Ombudsman said the scheme led to some of the most questionable decisions she has seen.",Victoria,https://theage.com.au/politics/victoria/ombudsman-border-permits-were-downright-unjust-even-inhumane-20211206-p59fat.html
Career criminal Peter Foster claimed he had a medical condition before fleeing police,Career criminal and fugitive Peter Foster has been arrested and will be extradited to Queensland after police tracked him down in Victoria. ,Queensland,https://theage.com.au/national/queensland/career-criminal-peter-foster-claimed-he-had-a-medical-condition-before-fleeing-police-20211207-p59fji.html
‘Get it off’: Teen saved friend from shark attack,"Jack Shaw, 15, was bitten on his back by a shark as he tried to free a friend from its jaws during a swim at Ocean Grove on Monday night.",Victoria,https://theage.com.au/national/victoria/get-it-off-teen-saved-friend-from-shark-attack-20211207-p59fmd.html
Baby shaking appeal turns on credibility of expert witness,Jesse Vinaccia is serving more than eight years in jail for killing his girlfriend’s baby. But the scientific evidence that was used to convict him has come under question.,National,https://theage.com.au/national/baby-shaking-appeal-turns-on-credibility-of-expert-witness-20211206-p59f1y.html
Experts question Labor’s claim it will cut power bills by $378 by 2030,"Labor says consumers will have lower power bills under its energy policy that ramps up renewable energy, but experts say the modelling is overly optimistic.",Federal,https://theage.com.au/politics/federal/experts-question-labor-s-claim-it-will-cut-power-bills-by-378-by-2030-20211207-p59fi6.html
Final green light for children’s COVID vaccines due by the end of the week,The government is confident it will have the supplies to start the vaccine rollout to five to 11-year-olds in January and continue through the first school term.,Federal,https://theage.com.au/politics/federal/final-green-light-for-children-s-covid-vaccines-due-by-the-end-of-the-week-20211207-p59fgf.html
House values soar by $2 trillion since start of pandemic,The Reserve Bank has left itself room to start normalising the cost of mortgages as record-low interest rates helped drive up the value of the nation’s residential properties.,Federal,https://theage.com.au/politics/federal/rba-sits-tight-over-christmas-as-house-values-soar-20211207-p59fe3.html
Industry prepared to work with Labor on climate as green groups hit out,"Heavy polluters are willing to work with Labor on its use of the Safeguard Mechanism to reduce emissions by 43 per cent, but environmental groups want bigger target.",Federal,https://theage.com.au/politics/federal/industry-prepared-to-work-with-labor-on-climate-as-green-groups-hit-out-20211206-p59f8d.html
Liberal senator attacks ABC for having ‘more lawyers than most law firms’,Sarah Henderson says the ABC’s employment of 50 staff lawyers is “obscene” and “completely disproportionate” to the broadcaster’s needs.,Federal,https://theage.com.au/politics/federal/liberal-senator-attacks-abc-for-having-more-lawyers-than-most-law-firms-20211203-p59enz.html
ASX set to jump as Omicron concerns ease,"Wall Street jumped on views the Omicron COVID-19 variant will not cause major economic damage, while a timely shot of Chinese stimulus helped spark the rally.",Markets,https://theage.com.au/business/markets/asx-set-to-jump-as-omicron-concerns-ease-20211208-p59fox.html
Trump’s media deal under scrutiny by market regulators,"Regulators are looking into the deal that would bring Donald Trump’s new social media company to the stock market, one that has attracted both legions of fans of the former president and people looking to make a quick profit.",Companies,https://theage.com.au/business/companies/trump-s-media-deal-under-scrutiny-by-market-regulators-20211207-p59fck.html
The Magellan mystery: Why CEO Brett Cairns called it quits,"The former Magellan chief executive was ostensibly the silent partner of a rock star management duo. He had the title, but executive chairman Hamish Douglass had most of the power and all the stage.",Companies,https://theage.com.au/business/companies/the-magellan-mystery-why-ceo-cairns-called-it-quits-20211207-p59fhx.html
"UK prioritised animals over people during Kabul airlift, says whistleblower","Raphael Marshall, a former Foreign Office desk officer, said thousands of emails asking for help were never even read.",Europe,https://theage.com.au/world/europe/uk-prioritised-animals-over-people-during-kabul-airlift-says-whistleblower-20211208-p59foi.html
One of suspected killers of Saudi journalist Khashoggi arrested in Paris,The arrest came just days after French President Emmanuel Macron held face-to-face talks in Saudi Arabia with de facto ruler Crown Prince Mohammed bin Salman.,Europe,https://theage.com.au/world/europe/one-of-suspected-killers-of-saudi-journalist-khashoggi-arrested-in-paris-20211208-p59fos.html
The value of the Austins’ home jumped by $500k - when a white friend posed as the homeowner,Paul and Tenisha Austin suspected the valuer had underestimated their family home. So they made it look like a white family owned it.,North America,https://theage.com.au/world/north-america/the-value-of-the-austins-home-jumped-by-500k-when-a-white-friend-posed-as-the-homeowner-20211207-p59fkd.html
Merkel’s successor achieves something she never did: gender parity,"Angela Merkel, a conservative, long shunned the word feminist. Until her final years in power, she rarely publicly promoted the issue of advancement for women.",Europe,https://theage.com.au/world/europe/merkel-s-successor-achieves-something-she-never-did-gender-parity-20211207-p59fky.html
Winter Games present opportunity to press China on human rights,Oppressive regimes are increasingly using the glitz and glamour of hosting major sporting events to deflect from deplorable human rights abuses.,Asia,https://theage.com.au/world/asia/winter-games-present-opportunity-to-press-china-on-human-rights-20211207-p59feq.html
Celebrating an ‘academic pandemic’ for three generations,"Travel was off the cards, but the COVID-19 pandemic was a catalyst for us to hit the books and aim for the next level in our careers.",Victoria,https://theage.com.au/national/victoria/celebrating-an-academic-pandemic-for-three-generations-20211207-p59fi5.html
Bitcoin ‘flash crash’ shatters the crypto illusion,Last weekend’s crypto meltdown has shown that the new asset class has an exaggerated correlation with other risky assets. That’s not what was supposed to happen.,Markets,https://theage.com.au/business/markets/bitcoin-flash-crash-shatters-the-crypto-illusion-20211207-p59fek.html
Response to skills shortages needs to be placed on a war footing,All sides of politics need to be on the same page when it comes to tackling Australia’s severe skills shortage.,National,https://theage.com.au/national/response-to-skills-shortages-needs-to-be-placed-on-a-war-footing-20211206-p59f4j.html
Rental prices tipped to rise as vacancies hit multi-year low,"Renters across Australia face fewer options in finding their next home, with vacancy rates at a multi-year low and expected to fall further.",News,https://theage.com.au/property/news/rental-prices-tipped-to-rise-as-vacancies-hit-multi-year-low-20211206-p59f5e.html
Hungry home hunters push prices up in capital cities,"Clearance rates were slightly down, but there was some keen bidding at key auctions.",News,https://theage.com.au/property/news/hungry-home-hunters-push-prices-up-in-capital-cities-20211206-p59f58.html
Do house prices really double every 10 years?,"The old saying goes that property prices double every decade, but new figures show the locations where price growth has been even stronger – and where it hasn’t kept pace.",News,https://theage.com.au/property/news/do-house-prices-really-double-every-10-years-20211203-p59eif.html
Mystery buyer splashes $9.175 million on Albert Park home at hot auction,"A four-bedroom Victorian terrace in Albert Park sold for $2.575 million above the top end of the price guide, while other homes passed in on a weekend that revealed the property market’s extremes.",News,https://theage.com.au/property/news/mystery-buyer-splashes-9-175-million-on-albert-park-home-at-hot-auction-20211204-p59esm.html
Living the suite life: What it’s really like to live in a hotel year-round,"Ever wondered what it might be like to live in a hotel or holiday resort all year round? An increasing number of Australians are doing just that, in homes offering the best of both worlds.",Living,https://theage.com.au/property/living/living-the-suite-life-what-it-s-really-like-to-live-in-a-hotel-year-round-20211203-p59em7.html
Is 100 the new 75? The keys to ageing well,"Centenarians are the fastest growing age group in many developed countries, including Australia. How can we stretch our health span so that if we do reach 100 we’re in good shape?",Health & wellness,https://theage.com.au/lifestyle/health-and-wellness/is-100-the-new-75-20211207-p59fe5.html
The Guccis are really not happy about ‘House of Gucci’,"Following its release in the US, the family issued a statement claiming it is “anything but accurate” while taking aim at the depiction of Patrizia Reggiani played by Lada Gaga.",Fashion,https://theage.com.au/lifestyle/fashion/the-guccis-are-really-not-happy-about-house-of-gucci-20211202-p59e32.html
Does smiling really make you look younger?,"A new study has found that smiling actually makes people look older – unless they are over 60, in which case the wrinkles have set in and it makes little difference.",Beauty,https://theage.com.au/lifestyle/beauty/does-smiling-really-make-you-look-younger-20211206-p59f3l.html
The muscle group that’s vital for running is also the most ignored,"Around 50 per cent of women don’t engage their pelvic floor properly. For female runners in particular, that can spell trouble.",Health & wellness,https://theage.com.au/lifestyle/health-and-wellness/the-muscle-group-that-s-vital-for-running-is-also-the-most-ignored-20211206-p59f3g.html
The luxury consignment stores selling out on Instagram,Purchasing high-end pre-loved clothing via live Instagram auctions provided a retail therapy hit for many during lockdown. It’s not slowing down any time soon.,Fashion,https://theage.com.au/lifestyle/fashion/the-luxury-consignment-stores-selling-out-on-instagram-20211118-p59a0o.html
"More than 200 kung fu films later, Jason Phu had his own movie to make","Inspiration can strike when you least expect it - and for artist Jason Phu, it came in the form of martial arts movies.",Movies,https://theage.com.au/culture/movies/more-than-200-kung-fu-films-later-jason-phu-had-his-own-movie-to-make-20211115-p59952.html
"For lovers of fresh jazz, Melbourne’s festival overflowed with new sounds",Many album launches made at the Melbourne International Jazz Festival had been postponed multiple times.,Music,https://theage.com.au/culture/music/for-lovers-of-fresh-jazz-festival-overflowed-with-new-sounds-20211206-p59f6m.html
Best in show: the top TV programs of 2021,"There was so much great TV in 2021, our panel of critics couldn’t settle on one single winner.",TV & radio,https://theage.com.au/culture/tv-and-radio/best-in-show-the-tv-highlights-of-a-year-like-no-other-20211203-p59emz.html
Engrossing short stories and new work from a Booker winner: what to read this week,Giselle Au-Nhien Nguyen and Steven Carroll have cast their eyes over recent fiction and non-fiction releases.,Books,https://theage.com.au/culture/books/stories-from-another-wolitzer-and-evaristo-s-manifesto-what-to-read-20211129-p59d37.html
Drake withdraws himself from competition for 2022 Grammy Awards,The chart-topping rapper and singer’s withdrawal is just the latest problem for the embattled awards.,Music,https://theage.com.au/culture/music/drake-withdraws-himself-from-competition-for-2022-grammy-awards-20211207-p59fi8.html
Smith’s Ashes advice to Australia’s new captain,Steve Smith has advice for Pat Cummins that only comes from hard personal experience.,Cricket,https://theage.com.au/sport/cricket/smith-s-ashes-advice-to-australia-s-new-captain-20211207-p59fkl.html
World No.1 Barty named WTA Player of the Year for a second time,"Ash Barty takes top women’s gong, while US Open champion Emma Raducanu wins Newcomer of the Year.",Tennis,https://theage.com.au/sport/tennis/world-no-1-barty-named-wta-player-of-the-year-for-a-second-time-20211208-p59foj.html
Fraser-McGurk screamer helps Renegades win thriller against Strikers,An early contender for catch of the season from Jake Fraser-McGurk has helped the Melbourne Renegades overcome a dramatic batting collapse to beat the Adelaide Strikers by two runs.,Cricket,https://theage.com.au/sport/cricket/fraser-mcgurk-screamer-helps-renegades-win-thriller-against-strikers-20211207-p59fec.html
Box seat: Pakula says day-night Ashes Test at MCG too good to pass up,"Melbourne’s sporting precinct could become the centre of world sport in the middle of January, with the Victorian Government saying the MCG’s case to host the fifth Ashes Test as the Australian Open begins is undeniable.",Cricket,https://theage.com.au/sport/cricket/day-night-ashes-test-at-the-mcg-too-good-to-pass-up-pakula-20211207-p59fn2.html
Everything you need to know about the first Ashes Test,"The battle for cricket’s most famous urn is upon us. Here is all the information you’ll need; from teams, times and tips to television details, weather reports and key match-ups.",Cricket,https://theage.com.au/sport/cricket/everything-you-need-to-know-about-the-first-ashes-test-20211207-p59fm8.html
‘Daunting prospect’: Why Warner’s 2019 nightmare has no bearing on Ashes,Captain Pat Cummins’ assessment of the dynamic opener’s fear factor in the nets highlights England’s difficulty in taming the man known as ‘The Bull’ on Australian soil.,Cricket,https://theage.com.au/sport/cricket/daunting-prospect-why-warner-s-2019-nightmare-has-no-bearing-on-ashes-20211207-p59fjx.html
Aus Open intrigue as Djokovic signs on for Sydney event,"World No.1 Novak Djokovic has committed to the ATP Cup in Sydney, a tournament that requires players to submit to the same vaccination rules as the Australian Open.",Tennis,https://theage.com.au/sport/tennis/novak-djokovic-confirmed-for-atp-cup-in-sydney-organisers-say-20211207-p59fkj.html
"Anderson out of first Ashes Test, saved for the pink ball","Anderson’s withdrawal from contention for England’s bowling attack for the first Ashes Test at the Gabba caused a hubbub, but the move looks as much tactical as it is medical.",Cricket,https://theage.com.au/sport/cricket/jimmy-anderson-out-of-first-ashes-test-saved-for-pink-ball-20211207-p59ffv.html
Broadcasters want the fifth Ashes Test at the ‘iconic’ MCG or SCG,Broadcasters will be central to bidding for the fifth Ashes Test and already have a strong preference for Melbourne or Sydney to host the clash.,Cricket,https://theage.com.au/sport/cricket/broadcasters-want-the-fifth-ashes-test-at-the-iconic-mcg-or-scg-20211207-p59fjc.html
Cummins says Australia won’t be ‘picking fights’ during a testing Ashes summer,"Pat Cummins knows tensions will rise on the field during an intense series, but has laid down some cultural foundations for his team before the series against England.",Cricket,https://theage.com.au/sport/cricket/cummins-says-australia-won-t-be-picking-fights-during-a-testing-ashes-summer-20211207-p59fl6.html
"Red Bull cranks up pressure on F1 race chief, Australia’s Michael Masi","Helmut Marko has added to the pressure that has been steadily building on Australian FIA race director Michael Masi over the past few weeks, saying the decision-making by Masi and race stewards in Saudi Arabia on Sunday was “very one-sided”.",Motorsport,https://theage.com.au/sport/motorsport/red-bull-cranks-up-pressure-on-f1-race-chief-australia-s-michael-masi-20211207-p59fi9.html
