Title,Description,Section,Keywords
Newsletter Signup Redirect | The Age,,newsletter-signup,
‎Bondi Badlands on Apple Podcasts,‎True Crime · 2021,,
"New Sudoku playable every day on the web, mobile and app as part of your digital subscription",,puzzles,
"Australia news LIVE: Omicron COVID-19 cases grow in NSW as exposure sites listed in Sydney, Central Coast; marathon Victorian pandemic bill debate continues","Authorities say a NSW woman visited a number of retail stores while infectious with the Omicron coronavirus variant, a parliamentary debate over Victoria’s new pandemic laws has run all night and the Prime Minister has vowed the country won’t go back into lockdown.",National,"NATIONAL NEWS LIVE,coronavirus pandemic,coronavirus pandemic live"
COVID-19 still causing classroom chaos as schools head list of cluster sites,"Victoria’s schools are no longer closing at the first sign of a COVID-19 case, but the virus continues to cause plenty of uncertainty and disruption in the classroom.",Victoria,"EDUCATION,coronavirus pandemic,high school,primary school,schools"
House price growth slows to lowest level since January,The Sydney and Melbourne housing boom slowed dramatically in November with new data showing the nation’s property prices had their slowest month of growth since January.,Federal,"PROPERTY PRICES,sydney house prices,melbourne house prices,property market,sydney,australian prudential regulation authority"
"Upper house finishes with pandemic bill after 21-hour, all-night debate","The upper house pulled an all-nighter but has finished debating Victoria’s contentious pandemic bill, which is on its way back to the lower house.",Victoria,"CORONAVIRUS PANDEMIC,victorian parliament"
Heritage row fails to stop Besen’s Fitzroy building,A controversial development by high-profile businessman and philanthropist Daniel Besen near the UNESCO listed Royal Exhibition Building will go ahead.,Companies,"COMMERCIAL REAL ESTATE,urban planning"
Police launch unit to investigate domestic abusers within the force,A new specialist team of police will begin investigating family violence within the force’s own ranks with a focus on conflicts of interest that have plagued enforcement of domestic violence allegations in regional Victoria.,Victoria,"VICTORIA POLICE,domestic violence"
Devastating rise in child drownings during lockdown,The latest drowning report from Life Saving Victoria outlines a heartbreaking rise in children drowning and deaths in home pools and baths.,Victoria,WATER SAFETY
"Meet Marta Ortega Pérez, the most powerful woman in fashion you’ve never heard of","Three months ago, Marta Ortega, the youngest Zara heiress, said she had no plans to take a formal leadership role in her father’s fashion empire. Now she’s taken over.",Fashion,FASHION RETAIL
‘Good time to retire that word’: Fed chief’s abrupt change of heart shakes markets,The markets didn’t appreciate Fed chief Jerome Powell’s pivot and the prospect it raises of  interest rate rises arriving sooner than previously anticipated.,Markets,"INFLATION,opinion,world markets,wall street"
"When official interest rates rise, how much will your mortgage payments go up?",Economists have been crunching the numbers and believe interest rates would not need to rise much before they start to have a significant impact on how much you will pay on your monthly mortgage.,Borrowing,"INTEREST RATES,analysis,reserve bank of australia,home loans"
December 2021 hit list: Hot and new places to eat and drink in Victoria this month,"The best bar, cafe and restaurant openings so far of 2021 to add to your must-visit list.",Restaurant,
Olivia Colman and her husband join forces for genre-bending true crime series,Ed Sinclair wrote the role of a true-life murderer for his wife Olivia Colman to play as he felt that not enough notice was taken of her talents in a straight role.,TV & radio,"TV REVIEWS,green guide,streaming"
So what is ‘the Melbourne sound’? Local musicians have some thoughts,"Delayed by lockdown, this year’s jazz festival emphasises diversity.",Music,"MUSIC FESTIVALS,spectrum the age"
"‘Last dance’: Judgment day for Ashes stars, says Botham",Ian Botham says there is much on the line for the veterans in the Australian and England teams this summer.,Cricket,"THE ASHES,australian cricket,england cricket"
Ugle-Hagan on the Bulldogs path I followed: Weightman,"Cody Weightman says after being picked high in the draft and being pumped up for months, he expected to make an immediate impact. He knows now the road is different for everyone.",AFL,"AFL 2021,western bulldogs"
Jokes all round at PM’s Yule by the pool,"The press gallery converged on the Lodge on Monday night for drinks and canapes and jollity, but what happened to Josh Frydenberg’s finger?",Victoria,"MELBOURNE CITY LIFE,opinion"
Director breaks down the false glamour of casinos in new film,"Paul Shrader’s latest film, The Card Counter, follows the bleak existence of a professional card player",Movies,"CINEMA,sydney arts"
Inside the nightmares of Hollywood’s ‘mad god’ monster-maker,"Phil Tippett has created creatures for movies from Star Wars to Jurassic Park. But his latest work, a terrifying trip into his subconscious, nearly broke him.",Movies,"FILM & TV PRODUCTION,film,melbourne arts,see & do,what's on melbourne"
"Australia news LIVE: Omicron COVID-19 cases grow in NSW as exposure sites listed in Sydney, Central Coast; marathon Victorian pandemic bill debate continues","Authorities say a NSW woman visited a number of retail stores while infectious with the Omicron coronavirus variant, a parliamentary debate over Victoria’s new pandemic laws has run all night and the Prime Minister has vowed the country won’t go back into lockdown.",National,"NATIONAL NEWS LIVE,coronavirus pandemic,coronavirus pandemic live"
Richard Branson has sold $1.4 billion Virgin Galactic stake during the pandemic,"The billionaire just offloaded another $420 million in shares in his space travel venture, tapping his biggest listed asset to prop up a business empire that has suffered during the COVID-19 pandemic.",Companies,"BILLIONAIRES,richard branson,space,sharemarket"
Follow-up hit: Davies in spotlight again but keen to shine brighter,The big-hitting Thunder young gun burst onto the Big Bash scene last year but his success also led to extra attention.,Cricket,"BIG BASH,stuart clark"
Plans hatched to stage Kambosos title defence in Parramatta,Tim and Kostya Tszyu have already fought there and now plans are being hatched for George Kambosos jnr’s first title defence to be held in Parramatta.,Boxing,WORLD BOXING
Bevan Shields named editor of The Sydney Morning Herald,The Sydney Morning Herald has appointed its new editor.,NSW,"MEDIA & MARKETING,the sydney morning herald"
Scott Morrison embraces culture wars with religious bill,"Free speech, identity politics and cancel culture all got an airing when the Prime Minister introduced the proposed religious discrimination bill to Parliament.",Federal,"RELIGION,lgbtqi,scott john morrison,political leadership,discrimination,opinion"
"PM calls for kinder, gentler behaviour ... and goes for the jugular",Scott Morrison told a media conference that standards of behaviour in Parliament must improve. Soon after there was a wild squall of verbal slurs in question time.,Federal,"POLITICAL SKETCH,parliament house act,opinion,scott john morrison,peter craig dutton,anthony norman albanese,political leadership"
Good Food Guide 2022: Full list of Victorian restaurants,"This time, there are no scores and no hats. But if it's in the Guide, it's good.",Good Food Guides,
,,,
Good Food Guide 2022: All the Victorian lists,"The essential collection of Victoria's most exciting top 10s, It Lists, bars, cafes, innovators and more from the <i>Good Food Guide 2022</i> magazine. Find every detailed restaurant review in the <i>Good Food Guide</i> magazine, available free in <i>The Age</i> on November 30, and for $9.95 from supermarkets and newsagents from December 7. ",Good Food Guides,
Parents fear ‘death knell’ for community childcare as council seeks to sell centres,Parents say a proposal by an inner-city council to sell three community-run childcare centres is a cost-cutting exercise at the expense of children.,Victoria,EDUCATION
Search team tight-lipped after discovery of human remains near Dargo,Police found the human remains in remote bushland after hours of sifting through dirt in a painstaking search for missing campers Russell Hill and Carol Clay.,Victoria,"CRIME,missing person"
Ella the koala was rescued six times in a year. She’s not the only one,Almost 20 NSW wildlife carer groups have written to Premier Dominic Perrottet and Environment Minister Matt Kean asking for stronger koala protection laws.,Conservation,ANIMALS
Police team behind Cleo rescue honoured at state reception in Perth,"Cleo’s parents Ellie Smith and Jake Gliddon made the trip south for the state reception at Government House, where WA Premier Mark McGowan and Governor Kim Beazley were due to host those behind the policing feat.",WA,"CLEO SMITH DISAPPEARANCE,perth wa,mark mcgowan"
Far-right threat under spotlight as Andrews government backs probe,"An expert on extremism has urged state parliamentarians to support the Greens-led inquiry, warning the far right is one of the greatest challenges of our time.",Victoria,"RIGHT-WING EXTREMISM,extremism,victorian parliament"
Nissan electric sports car concept breaks cover,A range of four new concept vehicles has provided a glimpse into Nissan's future electric line-up. Japanese manufacturer Nissan has taken the covers off,,
Aged care sector under fire as top nurse details St Basil’s ‘fit for purpose’ decision,"The COVID-19 pandemic has increased the likelihood of poor care for those in nursing homes, a new report says. Meanwhile, the Chief Nursing Officer has said the deadly outbreak at St Basil’s was not her fault.",Victoria,"CORONAVIRUS PANDEMIC,aged care,melbourne"
"Melbourne emergency nurse, mother of three dies of COVID-19",The nurses union believes Gillian “Jill” Dempsey’s death could be the first COVID-19 fatality of a Victorian hospital worker.,National,"CORONAVIRUS PANDEMIC,tragedy"
What is the endgame of COVID-19?,The Omicron variant has many of us asking “when will COVID-19 end?” The answer depends on what exactly you’re talking about.,National,"CORONAVIRUS PANDEMIC,science,analysis,vaccination"
Scott Morrison makes big tech crackdown a re-election pitch,"Scott Morrison talked up his track record in taking on the tech giants, saying it demonstrated his leadership abilities in a clear election campaign pitch.",Federal,"TECH CRACKDOWN﻿,scott john morrison,facebook,twitter"
Australian birds feel heat from climate but conservation offers hope,"A concerning number of Australia’s birds are also closer to extinction than they were 10 years ago, as climate change, the destruction of habitat and feral predators take a toll.",Climate change,"BIODIVERSITY,climate policy"
Greg Mirabella’s unorthodox road to Canberra,"As the husband of former Liberal MP Sophie Mirabella, he’s seen first hand how brutal life in politics can be, but Greg Mirabella comes to Parliament with his own agenda.",Federal,"AUSTRALIA VOTES,sophie mirabella,climate policy,murray-darling basin,liberal party"
Toxic impact of social media to be examined by parliamentary inquiry,"A broad-ranging inquiry into social media will begin hearings later this month, allowing the federal government to continue its big-tech crackdown campaign in the lead-up to the federal election.",Federal,"SOCIAL MEDIA,scott john morrison,cyber bullying,harassment,defamation"
Omicron gives sharemarket newbies taste of volatility,"History tells us that markets always recover over time, and those investors who hold their nerve and resist the temptation to sell generally do better than those who cut and run.",Investing,"SHAREMARKET,coronavirus pandemic,analysis,opinion"
"ASX down 0.9%; ANZ drops on class action, supermarkets drag",The S&P/ASX 200 is down 0.9% around midday and below 7200 points for the second time in three months with all sectors lower. GDP numbers were better than expected.,Markets,"MARKETS LIVE,investing"
Charging the dead: Why Westpac raised the white flag with ASIC,"The deal allows the regulator to notch up a handy win, polish its star and brandish its credentials as a results-regulator - all while saving money.",Banking & finance,"BIG FOUR BANKS,opinion,westpac banking corporation,peter king"
"‘Topping comes with a fly as a bonus’: Bubble tea chain under fire over wages, ingredients","A national bubble tea chain is in the sights of two federal watchdogs, with the most serious complaints alleging it sourced supplies contaminated with flies and small insects.",Companies,"FRANCHISING,food & drink,fair work ombudsman"
Accuser says Ghislaine Maxwell watched her have sexual contact with Jeffrey Epstein,The British socialite is facing charges of recruiting and grooming underage girls for convicted sex offender Jeffrey Epstein.,North America,"EPSTEIN FALLOUT,ghislaine maxwell,courts,jeffrey edward epstein"
Infections in Europe pre-date Omicron’s identification in South Africa,New data relating to the Omicron coronavirus variant on Tuesday confirmed that the strain was circulating in Europe well before South Africa sounded the alarm on November 24.,Europe,"CORONAVIRUS PANDEMIC,netherlands,united kingdom of great britain and northern ireland,scotland,vaccination,healthcare,south africa,research,science"
Vatican accuses EU of cancelling Christmas,"The European Commissioner for Equality, Helena Dalli, said the draft document had been intended to highlight European diversity.",Europe,"WORLD POLITICS,european union,vatican city,italy,culture wars,christmas"
Multiple fatalities in Michigan high school shooting,Authorities arrested the suspect at the school and recovered a handgun. They didn’t immediately release the names of the suspect or victims.,North America,"MASS SHOOTING,united states of america"
Pandemic bill saga shows need for greater government transparency,Aspects of the bill before extra negotiations point to a problem of arrogance and overreach within the state government.,Victoria,"CORONAVIRUS PANDEMIC,opinion,daniel michael andrews,the age editorial"
Start with the name for true reform of cosmetic surgery,"A review of patient safety issues in the cosmetic sector after decades of devastating patient harm is long overdue, but there is a long way to go before true reform takes place.",Consumer affairs,"COSMETIC COWBOYS,opinion,healthcare,regulation"
The jig is up: Time to rein in the cosmetic surgery industry,Regulators must take meaningful steps to rein in the Wild West that is Australia’s cosmetic surgery industry.,Health & wellness,"COSMETIC COWBOYS,opinion"
Messy politics and ugly scenes: How a sensible bill became a controversy,"It was a messy journey, but the Andrews Government got there in the end: the new pandemic bill strikes a sensible balance.",Victoria,"CORONAVIRUS PANDEMIC,analysis,victorian parliament"
The Australian trip that bolstered Matthew McConaughey to reject deals worth millions,The Oscar-winning actor once gambled his Hollywood career for better roles. Australia – and the outdoors – were the keys to enduring two years out of work.,Life & relationships,"TRAVEL,wellness,matthew mcconaughey"
Inside the strong bond between Australia’s top fashion prize winners,The winners of this year’s Australian Laureate Awards share a creative connection that can be followed back to pioneer Linda Jackson.,Fashion,"AUSTRALIAN FASHION,fashion designers"
"And on the first day post-lockdown, she bought a Christmas tree","It’s not yet December but social media feeds are lighting up with fairy lights, baubles and cheer to remedy 2021’s woes.",Life & relationships,"CHRISTMAS,family,home"
Make-up with a side of true crime is the latest thing,YouTube creators offering tips on how to pull off a glittery eye while discussing real-life murders have exploded in popularity. What does this trend say about us?,Beauty,"FASHION & BEAUTY TRENDS,gender"
How to reevaluate friendships and take steps to repair them,The mark of a good relationship comes down to two questions: “Do I feel good about myself after seeing them?” and “Does this person make me feel like I’m understood?”,Life & relationships,"FRIENDSHIP,wellbeing,mental health"
No actor brought so many gifts to the Australian screen for so long,He had everything he needed to become a star and not enough of what he needed to cope with stardom.,Movies,"VALE,indigenous culture,indigenous australians,opinion,david gulpilil"
David Dalaithngu was a mesmerising movie presence,"David Dalaithngu was one of Australia’s finest actors - a charismatic, mesmerising, loose-limbed presence on screen for half a century.",Movies,"OBITUARIES,david gulpilil,vale"
"A toast to TV’s quiet achievers, the ones that consistently deliver","Discussion of TV is often dominated by the newest and buzziest shows, not the ones that have reached 30-plus season milestones.",TV & radio,"TV REVIEWS,green guide"
‘Once-in-a-generation’ actor David Dalaithngu dies,South Australian Premier Steven Marshall confirmed the news in a statement late on Monday night.,National,"VALE,david gulpilil,steven spence marshall,south australia"
Tim Ferguson wants comedy revolution – with his wheelchair out the front,The DAAS star says modern comedians are often too scared to tackle topics that might get them cancelled.,Comedy,"COMEDY,stand-up comedy,what's on melbourne,see & do,melbourne arts"
Four fresh and tasty Vietnamese recipes anyone can make at home,"Vietnamese cooking is all about vibrancy, Perth chef and restaurateur Jenny Lam believes.",News,
December 2021 hit list: Hot and new places to eat and drink in Victoria this month,"The best bar, cafe and restaurant openings so far of 2021 to add to your must-visit list.",Restaurant,
Sugary slice and all things nice: The 21 most popular recipes of November 2021,"The Biscoff slice of dreams, crash-hot potato recipes, some new midweek chicken winners and more dishes that made you happy in November 2021. ",Recipe Collections,
The foreign dishes Australia has adopted - and totally stuffed up,"Some foreign dishes we have respected in their original form, some we've even improved on – and some we've totally stuffed up. ",Food & Wine,
"The ugly, abandoned hole that created Melbourne",Melbourne's grandest buildings had much less grand beginnings. ,Destination relative,
'Mirry Christmus': Air New Zealand’s seasonal ads are more naughty than nice,Here's a quick look at New Zealand's national carrier's adverts from Christmas past.,Destination relative,
"2022 Honda Civic starting price rises by $16,200, to $47,200 drive-away","The new Honda Civic hatchback will be available in Australian showrooms next week with just one model priced from $47,200 drive-away – $16,200 more than",,
Aussie F1 star Daniel Ricciardo opens up about shocker season with McLaren,"Australian Formula One ace Daniel Ricciardo may have scored McLaren’s first win since 2012, but he has been outpaced by his teammate for more than half",,
Watch NITRAM Online | Now Streaming | A Stan Original Film.,"The Stan Original Film Nitram, from acclaimed director Justin Kurzel is now streaming.",,
Watch Yellowstone TV Series | Season 4 Now Streaming | Stan.,"Yellowstone Season 4 Now Streaming, Only on Stan. Watch Seasons 1-3 of Yellowstone, the Acclaimed TV Show Starring Kevin Costner. Start Your Free Trial.",,
"‘Last dance’: Judgment day for Ashes stars, says Botham",Ian Botham says there is much on the line for the veterans in the Australian and England teams this summer.,Cricket,"THE ASHES,australian cricket,england cricket"
Ugle-Hagan on the Bulldogs path I followed: Weightman,"Cody Weightman says after being picked high in the draft and being pumped up for months, he expected to make an immediate impact. He knows now the road is different for everyone.",AFL,"AFL 2021,western bulldogs"
Venues NSW boss eager for Sydney to take F1 grand prix from Melbourne,The event has been staged at Melbourne’s Albert Park every year since 1996 - except for the past two due to COVID restrictions.,Motorsport,"FORMULA 1 AUSTRALIAN GRAND PRIX,formula 1"
Woods gives few details on accident and return date but ‘would love’ to play British Open,"The US star, who was close to having his leg amputated after he lost control of his car in February, was tight-lipped when asked about the crash.",Golf,"PGA TOUR,british open golf,tiger woods"
Money or politics? Cricket Australia’s $17m Ashes Test conundrum,Mark McGowan’s closed border populism has left Cricket Australia with an age-old conundrum - loyalty to the game’s structure or hunger for revenue. The venue for the fifth Ashes Test could make a $17 million difference.,Cricket,"AUSTRALIAN CRICKET,cricket australia,test cricket,mark mcgowan,boxing day test"
"Injured Goulding out of NBL season-opener, in race to be fit for Melbourne derby","Melbourne United star Chris Goulding will miss the NBL opener against the Sydney Kings, having been hurt at training on Tuesday.",Basketball,NATIONAL BASKETBALL LEAGUE
A small tax now: how the Hawks are paying out Clarkson’s contract,Hawthorn have taken a hit and paid a small tax to the AFL for exceeding the soft cap in the year coach Alastair Clarkson left but are confident his pay-out won’t affect their budget.,AFL,"HAWTHORN HAWKS,afl 2021"
"In the Paine saga, the buck stops where no one cares to look","Fingers pointed in every direction at the downfall of Tim Paine as Test captain, but it was first of all a matter of personal responsibility.",Cricket,"AUSTRALIAN CRICKET,timothy david paine,opinion"
Late Simon strike saves Matildas as early lapse again underlines defensive issues,"A late strike from Kyah Simon has helped the Matildas paper over the cracks of another poor defensive display, salvaging a 1-1 draw against the United States on Tuesday night.",Soccer,"MATILDAS,us soccer"
Carey set for baggy green at the Gabba,"The South Australian wicketkeeper has performed strongly in a World Cup, held an official leadership position and is battle-hardened by recent match practice.",Cricket,"THE ASHES,australian cricket,england cricket"
Collingwood stalwart Chiocci makes new AFLW campaign about succession planning,"AFLW Collingwood skipper Steph Chiocci has said it was a matter of “if it ain’t broke don’t fix it” when it came to her and Brianna Davey continuing their co-captaincy but, as the longest-serving AFLW captain she says it could be her last.",AFL,"WOMEN'S AFL,collingwood magpies,afl 2022,adelaide"
"Collingwood star Jordan De Goey arrives back in Australia, Pendlebury lends support","Collingwood forward Jordan De Goey has arrived back home and has been supported by Scott Pendlebury, as De Goey gets set to fight assault and harassment charges via video link into a New York courtroom next month.",AFL,"AFL 2021,collingwood magpies,afl off-field behaviour"
Cautious support from bookies to support horse welfare amid racehorse slaughter scandal,The Thoroughbred Welfare Initiative has broad support from industry participants however the funding required to implement its recommendations remains uncertain.,Racing,"HORSE RACING,martin pakula,martin philip pakula,tabcorp holdings limited"
"Cummins v Root takes Ashes rivalry to new levels, says Buttler","Rarely do opposing captains go head-to-head in a Test, but the appointment of Pat Cummins will give him the chance to square off against his English opposite.",Cricket,"THE ASHES,test cricket,australian cricket,england cricket"
"Snooker star nods off during match, blames COVID-19","Triple world champion Mark Williams has apologised to snooker fans for falling asleep during his own match at the UK championship, blaming the after-effects of COVID-19.",Sport,CORONAVIRUS PANDEMIC
‘He’ll still be a powerful beast’: How the Tigers rebuilt slim Dusty,Rebuilding Dustin Martin from serious injury involved a plan to cleanse and rejuvenate his body inside and out to add games at the end of the star’s career.,AFL,"AFL 2021,richmond tigers,dustin martin,afl 2022,afl injury ward"
Matildas concede in opening minutes once again,"Ashley Hatch scores in opening moments against Australia for the second straight game.
",Soccer,
Matildas concede in opening minutes once again,"Ashley Hatch scores in opening moments against Australia for the second straight game.
",Soccer,
Matildas concede in opening minutes once again,"Ashley Hatch scores in opening moments against Australia for the second straight game.
",Soccer,
Matildas concede in opening minutes once again,"Ashley Hatch scores in opening moments against Australia for the second straight game.
",Soccer,
Matildas concede in opening minutes once again,"Ashley Hatch scores in opening moments against Australia for the second straight game.
",Soccer,
